work_package,original_budget_rm_m,approved_vo_rm_m,pending_vo_rm_m,actual_cost_jan_rm_m,actual_cost_feb_rm_m,actual_cost_to_mar_rm_m,forecast_at_completion_rm_m,planned_progress_pct,actual_progress_pct,cost_variance_rm_m,schedule_variance_pct,primary_vo_ref,remarks
Viaduct Civil Works,520,8,6,201,223,245,544,46.0,44.5,16,-1.5,VO-018,"Pier erection impacted by rainfall in Feb; recovery using weekend shifts"
Pandan Gateway Station Structural and Architectural,210,4,3,58,66,74,219,37.0,35.8,5,-1.2,VO-014,"Concourse slab achieved; architectural shop drawing approvals mostly on track"
Cheras North Station Structural and Architectural,225,7,12,47,54,62,249,34.0,28.5,17,-5.5,VO-021,"Utility conflict and revised foundation detailing slowed progress materially"
Utilities Relocation,95,6,5,31,34,38,105,60.0,48.0,4,-12.0,VO-019,"Telecom and water main diversions delayed; Cheras North approvals not fully secured"
Systems Interface and Design Coordination,78,3,2,20,24,29,84,58.0,53.0,3,-5.0,VO-017,"Signalling and traction power interface package partially approved only"
Traffic Management and Temporary Works,46,1,0,14,15,17,48,52.0,50.0,1,-2.0,VO-012,"Night work restrictions reduced productivity at two work fronts"
Preliminaries and Site Overheads,72,0,0,27,31,34,79,39.0,39.5,7,0.5,NA,"Extended supervision, temporary access maintenance, and added safety marshals"
Testing and Commissioning Readiness,34,2,1,3,5,4,37,12.0,10.0,1,-2.0,VO-020,"Readiness activities pushed due to interface design lag"
